{"type":"object","properties":{"schema_version":{"const":"1.0.0"},"model_version":{"const":"mlr-1.0.0"},"split":{"const":"TEST"},"source":{"type":"object","properties":{"path":{"type":"string","pattern":"^(reports|artifacts|configs)/"},"sha256":{"type":"string","pattern":"^[a-f0-9]{64}$"}},"required":["path","sha256"],"additionalProperties":false},"sampling":{"type":"string"},"source_rows":{"const":2962},"scatter":{"type":"array","maxItems":512,"items":{"type":"object","properties":{"timestamp":{"type":"string","pattern":"^\\d{4}-\\d{2}-\\d{2} \\d{2}:\\d{2}:\\d{2}$"},"actual":{"type":"number"},"prediction":{"type":"number"},"residual":{"type":"number"},"lower":{"type":"number"},"upper":{"type":"number"},"interval_valid":{"type":"boolean"},"warnings":{"type":"string"}},"required":["timestamp","actual","prediction","residual","lower","upper","interval_valid","warnings"],"additionalProperties":false}},"histogram":{"type":"object","properties":{"edges":{"type":"array","items":{"type":"number"}},"counts":{"type":"array","items":{"type":"integer","minimum":0}}},"required":["edges","counts"],"additionalProperties":false},"qq":{"type":"object","properties":{"theoretical":{"type":"array","items":{"type":"number"}},"ordered_residual":{"type":"array","items":{"type":"number"}}},"required":["theoretical","ordered_residual"],"additionalProperties":false},"residual_acf":{"type":"array","items":{"type":"number"}}},"required":["schema_version","model_version","split","source","sampling","source_rows","scatter","histogram","qq","residual_acf"],"additionalProperties":false,"$schema":"https://json-schema.org/draft/2020-12/schema","$id":"urn:smart-home-energy:test-residuals:1.0.0"}