{"schema_version":"1.0.0","model_version":"mlr-1.0.0","split":"TEST","source":{"path":"reports/evaluation/c2-mlr-1.0.0/predictions.csv","sha256":"a7cc7c0f62b48a19ee4ceb5300b6d0eced850e439be4b82d9e6d31c710df3471"},"source_rows":2962,"sampling":"400 evenly spaced row indices union all negative estimates and top ten absolute errors; not representative for metric estimation","scatter":[{"timestamp":"2016-05-07 04:30:00","actual":60,"prediction":61.1900489372255,"residual":-1.190048937225498,"lower":0.0,"upper":246.5471703734249,"interval_valid":true,"warnings":""},{"timestamp":"2016-05-07 05:40:00","actual":50,"prediction":74.46989811813397,"residual":-24.46989811813397,"lower":0.0,"upper":259.8270195543334,"interval_valid":true,"warnings":""},{"timestamp":"2016-05-07 06:50:00","actual":60,"prediction":76.23118000901727,"residual":-16.231180009017265,"lower":0.0,"upper":261.58830144521664,"interval_valid":true,"warnings":""},{"timestamp":"2016-05-07 08:10:00","actual":90,"prediction":85.00971819409743,"residual":4.990281805902569,"lower":0.0,"upper":270.36683963029685,"interval_valid":true,"warnings":""},{"timestamp":"2016-05-07 09:20:00","actual":240,"prediction":78.24612435811696,"residual":161.75387564188304,"lower":0.0,"upper":263.60324579431636,"interval_valid":true,"warnings":""},{"timestamp":"2016-05-07 10:40:00","actual":270,"prediction":85.44717837405699,"residual":184.552821625943,"lower":0.0,"upper":270.8042998102564,"interval_valid":true,"warnings":""},{"timestamp":"2016-05-07 11:50:00","actual":100,"prediction":72.44919684160102,"residual":27.550803158398978,"lower":0.0,"upper":257.8063182778004,"interval_valid":true,"warnings":""},{"timestamp":"2016-05-07 13:00:00","actual":80,"prediction":87.52947679214884,"residual":-7.5294767921488415,"lower":0.0,"upper":272.88659822834825,"interval_valid":true,"warnings":""},{"timestamp":"2016-05-07 14:20:00","actual":100,"prediction":97.16100582736686,"residual":2.838994172633136,"lower":0.0,"upper":282.51812726356627,"interval_valid":true,"warnings":""},{"timestamp":"2016-05-07 15:30:00","actual":110,"prediction":85.91809409764858,"residual":24.081905902351423,"lower":0.0,"upper":271.275215533848,"interval_valid":true,"warnings":""},{"timestamp":"2016-05-07 16:50:00","actual":80,"prediction":94.22584764125455,"residual":-14.225847641254546,"lower":0.0,"upper":279.582969077454,"interval_valid":true,"warnings":""},{"timestamp":"2016-05-07 18:00:00","actual":80,"prediction":93.54054430864676,"residual":-13.540544308646759,"lower":0.0,"upper":278.89766574484617,"interval_valid":true,"warnings":""},{"timestamp":"2016-05-07 18:20:00","actual":630,"prediction":104.06397673458576,"residual":525.9360232654142,"lower":0.0,"upper":289.42109817078517,"interval_valid":true,"warnings":""},{"timestamp":"2016-05-07 19:20:00","actual":120,"prediction":101.73113209544168,"residual":18.26886790455832,"lower":0.0,"upper":287.0882535316411,"interval_valid":true,"warnings":""},{"timestamp":"2016-05-07 20:30:00","actual":100,"prediction":101.27980492564986,"residual":-1.2798049256498558,"lower":0.0,"upper":286.63692636184925,"interval_valid":true,"warnings":""},{"timestamp":"2016-05-07 21:40:00","actual":60,"prediction":96.13600317437312,"residual":-36.136003174373116,"lower":0.0,"upper":281.4931246105725,"interval_valid":true,"warnings":""},{"timestamp":"2016-05-07 23:00:00","actual":60,"prediction":90.62545627549942,"residual":-30.625456275499417,"lower":0.0,"upper":275.9825777116988,"interval_valid":true,"warnings":""},{"timestamp":"2016-05-08 00:10:00","actual":60,"prediction":58.56672195749442,"residual":1.4332780425055773,"lower":0.0,"upper":243.92384339369383,"interval_valid":true,"warnings":""},{"timestamp":"2016-05-08 01:30:00","actual":60,"prediction":62.86774678013248,"residual":-2.867746780132478,"lower":0.0,"upper":248.22486821633188,"interval_valid":true,"warnings":""},{"timestamp":"2016-05-08 02:40:00","actual":60,"prediction":67.25496455198731,"residual":-7.254964551987314,"lower":0.0,"upper":252.61208598818672,"interval_valid":true,"warnings":""},{"timestamp":"2016-05-08 04:00:00","actual":50,"prediction":67.48965219331606,"residual":-17.48965219331606,"lower":0.0,"upper":252.84677362951547,"interval_valid":true,"warnings":""},{"timestamp":"2016-05-08 05:10:00","actual":60,"prediction":62.53147288815987,"residual":-2.5314728881598683,"lower":0.0,"upper":247.88859432435927,"interval_valid":true,"warnings":""},{"timestamp":"2016-05-08 06:20:00","actual":50,"prediction":69.74935940027908,"residual":-19.749359400279076,"lower":0.0,"upper":255.10648083647848,"interval_valid":true,"warnings":""},{"timestamp":"2016-05-08 07:40:00","actual":90,"prediction":71.68206775223703,"residual":18.31793224776297,"lower":0.0,"upper":257.03918918843647,"interval_valid":true,"warnings":""},{"timestamp":"2016-05-08 08:50:00","actual":70,"prediction":88.40560812867027,"residual":-18.405608128670266,"lower":0.0,"upper":273.7627295648697,"interval_valid":true,"warnings":""},{"timestamp":"2016-05-08 10:10:00","actual":180,"prediction":81.90404575460083,"residual":98.09595424539917,"lower":0.0,"upper":267.2611671908002,"interval_valid":true,"warnings":""},{"timestamp":"2016-05-08 11:20:00","actual":50,"prediction":99.96172170451102,"residual":-49.96172170451102,"lower":0.0,"upper":285.31884314071044,"interval_valid":true,"warnings":""},{"timestamp":"2016-05-08 12:30:00","actual":60,"prediction":109.49227795375185,"residual":-49.49227795375185,"lower":0.0,"upper":294.84939938995126,"interval_valid":true,"warnings":""},{"timestamp":"2016-05-08 13:50:00","actual":50,"prediction":123.35464946842134,"residual":-73.35464946842134,"lower":0.0,"upper":308.7117709046207,"interval_valid":true,"warnings":""},{"timestamp":"2016-05-08 15:00:00","actual":40,"prediction":128.11323766341874,"residual":-88.11323766341874,"lower":0.0,"upper":313.4703590996181,"interval_valid":true,"warnings":""},{"timestamp":"2016-05-08 16:20:00","actual":60,"prediction":133.88163154710043,"residual":-73.88163154710043,"lower":0.0,"upper":319.23875298329983,"interval_valid":true,"warnings":""},{"timestamp":"2016-05-08 17:30:00","actual":60,"prediction":134.993934483386,"residual":-74.993934483386,"lower":0.0,"upper":320.3510559195854,"interval_valid":true,"warnings":""},{"timestamp":"2016-05-08 18:50:00","actual":60,"prediction":132.13081786138744,"residual":-72.13081786138744,"lower":0.0,"upper":317.4879392975869,"interval_valid":true,"warnings":""},{"timestamp":"2016-05-08 20:00:00","actual":70,"prediction":120.92033965588456,"residual":-50.92033965588456,"lower":0.0,"upper":306.27746109208397,"interval_valid":true,"warnings":""},{"timestamp":"2016-05-08 21:10:00","actual":80,"prediction":105.64995113667086,"residual":-25.649951136670865,"lower":0.0,"upper":291.00707257287024,"interval_valid":true,"warnings":""},{"timestamp":"2016-05-08 22:30:00","actual":60,"prediction":107.33861433537918,"residual":-47.33861433537918,"lower":0.0,"upper":292.6957357715786,"interval_valid":true,"warnings":""},{"timestamp":"2016-05-08 23:40:00","actual":60,"prediction":103.73515793655075,"residual":-43.73515793655075,"lower":0.0,"upper":289.09227937275017,"interval_valid":true,"warnings":""},{"timestamp":"2016-05-09 01:00:00","actual":50,"prediction":71.75000546839361,"residual":-21.75000546839361,"lower":0.0,"upper":257.10712690459303,"interval_valid":true,"warnings":""},{"timestamp":"2016-05-09 02:10:00","actual":60,"prediction":80.96626820380644,"residual":-20.966268203806436,"lower":0.0,"upper":266.32338964000587,"interval_valid":true,"warnings":""},{"timestamp":"2016-05-09 03:30:00","actual":50,"prediction":87.06235207369481,"residual":-37.06235207369481,"lower":0.0,"upper":272.4194735098942,"interval_valid":true,"warnings":""},{"timestamp":"2016-05-09 04:40:00","actual":60,"prediction":88.57032789006969,"residual":-28.57032789006969,"lower":0.0,"upper":273.9274493262691,"interval_valid":true,"warnings":""},{"timestamp":"2016-05-09 05:50:00","actual":50,"prediction":73.15550053539735,"residual":-23.15550053539735,"lower":0.0,"upper":258.5126219715968,"interval_valid":true,"warnings":""},{"timestamp":"2016-05-09 07:10:00","actual":50,"prediction":79.17341925795456,"residual":-29.173419257954563,"lower":0.0,"upper":264.53054069415396,"interval_valid":true,"warnings":""},{"timestamp":"2016-05-09 08:20:00","actual":50,"prediction":93.92182944649774,"residual":-43.92182944649774,"lower":0.0,"upper":279.27895088269713,"interval_valid":true,"warnings":""},{"timestamp":"2016-05-09 09:40:00","actual":60,"prediction":93.90355656001435,"residual":-33.90355656001435,"lower":0.0,"upper":279.26067799621376,"interval_valid":true,"warnings":""},{"timestamp":"2016-05-09 10:50:00","actual":50,"prediction":93.77290360656418,"residual":-43.772903606564185,"lower":0.0,"upper":279.1300250427636,"interval_valid":true,"warnings":""},{"timestamp":"2016-05-09 12:00:00","actual":70,"prediction":90.22876312065983,"residual":-20.228763120659835,"lower":0.0,"upper":275.58588455685924,"interval_valid":true,"warnings":""},{"timestamp":"2016-05-09 13:20:00","actual":360,"prediction":92.67188344005639,"residual":267.3281165599436,"lower":0.0,"upper":278.0290048762558,"interval_valid":true,"warnings":""},{"timestamp":"2016-05-09 14:30:00","actual":50,"prediction":90.45535294861756,"residual":-40.45535294861756,"lower":0.0,"upper":275.81247438481694,"interval_valid":true,"warnings":""},{"timestamp":"2016-05-09 15:50:00","actual":70,"prediction":92.54133190800731,"residual":-22.541331908007308,"lower":0.0,"upper":277.8984533442067,"interval_valid":true,"warnings":""},{"timestamp":"2016-05-09 17:00:00","actual":90,"prediction":91.5384468525876,"residual":-1.5384468525875974,"lower":0.0,"upper":276.895568288787,"interval_valid":true,"warnings":""},{"timestamp":"2016-05-09 18:20:00","actual":110,"prediction":104.53837675910523,"residual":5.461623240894767,"lower":0.0,"upper":289.89549819530464,"interval_valid":true,"warnings":""},{"timestamp":"2016-05-09 19:30:00","actual":110